{
  "$schema": "./drift-ignore.schema.json",
  "description": "Known Prisma drift patterns to ignore or sanitize during migration creation",
  "protectedIndexes": [
    {
      "name": "idx_memories_embedding",
      "table": "memories",
      "type": "ivfflat",
      "description": "IVFFlat vector index for BGE similarity search (384 dims). Dropping it degrades memory retrieval to sequential scans; Prisma can't represent Unsupported-type indexes, so it regenerates the DROP every time.",
      "recreateSQL": "CREATE INDEX \"idx_memories_embedding\" ON \"memories\" USING ivfflat (\"embedding\" vector_cosine_ops) WITH (lists = 50);",
      "dropPattern": "DROP\\s+INDEX.*idx_memories_embedding",
      "createPattern": "CREATE\\s+INDEX.*idx_memories_embedding"
    },
    {
      "name": "memories_chunk_group_id_idx",
      "table": "memories",
      "type": "partial",
      "description": "Partial index for chunk retrieval (WHERE chunk_group_id IS NOT NULL). Prisma generates a non-partial version, causing conflicts.",
      "recreateSQL": "CREATE INDEX \"memories_chunk_group_id_idx\" ON \"memories\"(\"chunk_group_id\") WHERE \"chunk_group_id\" IS NOT NULL;",
      "dropPattern": "DROP\\s+INDEX.*memories_chunk_group_id_idx",
      "createPattern": "CREATE\\s+INDEX.*memories_chunk_group_id_idx.*WHERE[\\s(]+(?:\"?memories\"?\\.)?\"?chunk_group_id\"?\\s*\\)*\\s+IS\\s+NOT\\s+NULL[\\s);]*$"
    },
    {
      "name": "idx_memory_facts_embedding",
      "table": "memory_facts",
      "type": "ivfflat",
      "description": "IVFFlat vector index for fact similarity retrieval (memory Phase 2). Dropping it silently degrades fact queries to sequential scans as the table grows.",
      "recreateSQL": "CREATE INDEX \"idx_memory_facts_embedding\" ON \"memory_facts\" USING ivfflat (\"embedding\" vector_cosine_ops) WITH (lists = 50);",
      "dropPattern": "DROP\\s+INDEX.*idx_memory_facts_embedding",
      "createPattern": "CREATE\\s+INDEX.*idx_memory_facts_embedding"
    }
  ],
  "ignorePatterns": [
    {
      "pattern": "DROP INDEX.*idx_memories_embedding",
      "reason": "IVFFlat vector index cannot be represented in Prisma schema",
      "action": "remove"
    },
    {
      "pattern": "CREATE INDEX.*memories_chunk_group_id_idx(?!.*WHERE)",
      "reason": "Prisma generates non-partial index, but we need the partial version",
      "action": "remove"
    },
    {
      "pattern": "DROP INDEX.*memories_chunk_group_id_idx",
      "reason": "Partial index cannot be represented in Prisma schema",
      "action": "remove"
    },
    {
      "pattern": "DROP INDEX.*tts_configs_free_default_unique",
      "reason": "Partial unique index with WHERE clause cannot be represented in Prisma schema (mirrors llm_configs_free_default_unique)",
      "action": "remove"
    },
    {
      "pattern": "DROP INDEX.*llm_configs_global_name_unique",
      "reason": "Partial unique index with WHERE clause cannot be represented in Prisma schema",
      "action": "remove"
    },
    {
      "pattern": "DROP INDEX.*tts_configs_global_name_unique",
      "reason": "Partial unique index with WHERE clause cannot be represented in Prisma schema (mirrors llm_configs_global_name_unique)",
      "action": "remove"
    },
    {
      "pattern": "DROP INDEX.*idx_memories_is_locked",
      "reason": "Partial index with WHERE clause cannot be represented in Prisma schema",
      "action": "remove"
    },
    {
      "pattern": "ALTER TABLE.*personas.*DROP CONSTRAINT.*personas_name_non_empty",
      "reason": "CHECK constraint added in Identity Epic Phase 5 \u2014 Prisma doesn't represent CHECK constraints so future migrate diffs try to drop it",
      "action": "remove"
    },
    {
      "pattern": "ALTER TABLE.*personas.*DROP CONSTRAINT.*personas_name_not_snowflake",
      "reason": "CHECK constraint added in Identity Epic Phase 5 (snowflake-name tripwire) \u2014 Prisma doesn't represent CHECK constraints so future migrate diffs try to drop it",
      "action": "remove"
    },
    {
      "pattern": "ALTER TABLE.*users.*ALTER CONSTRAINT.*users_default_persona_id_fkey.*NOT DEFERRABLE",
      "reason": "FK made DEFERRABLE INITIALLY IMMEDIATE in migration 20260418010642 so db-sync can atomically insert both sides of the users\u2194personas circular NOT NULL FK pair in one transaction. Prisma schema can't express DEFERRABLE so future diffs try to strip it.",
      "action": "remove"
    },
    {
      "pattern": "ALTER TABLE.*users.*ALTER CONSTRAINT.*users_default_llm_config_id_fkey.*NOT DEFERRABLE",
      "reason": "FK made DEFERRABLE INITIALLY IMMEDIATE in migration 20260418010642 for the users\u2194llm_configs circular pair. Prisma schema can't express DEFERRABLE.",
      "action": "remove"
    },
    {
      "pattern": "ALTER TABLE.*personas.*ALTER CONSTRAINT.*personas_owner_id_fkey.*NOT DEFERRABLE",
      "reason": "FK made DEFERRABLE INITIALLY IMMEDIATE in migration 20260418010642 for the users\u2194personas circular pair. Prisma schema can't express DEFERRABLE.",
      "action": "remove"
    },
    {
      "pattern": "ALTER TABLE.*llm_configs.*ALTER CONSTRAINT.*llm_configs_owner_id_fkey.*NOT DEFERRABLE",
      "reason": "FK made DEFERRABLE INITIALLY IMMEDIATE in migration 20260418010642 for the users\u2194llm_configs circular pair. Prisma schema can't express DEFERRABLE.",
      "action": "remove"
    },
    {
      "pattern": "ALTER TABLE.*users.*ALTER CONSTRAINT.*users_default_tts_config_id_fkey.*NOT DEFERRABLE",
      "reason": "FK made DEFERRABLE INITIALLY IMMEDIATE in migration 20260504065151 so db-sync can copy a user row with non-NULL default_tts_config_id before the matching tts_configs row arrives in the target DB (mirrors the LLM/persona pattern from migration 20260418010642). Prisma schema can't express DEFERRABLE.",
      "action": "remove"
    },
    {
      "pattern": "ALTER TABLE.*memory_facts.*ALTER CONSTRAINT.*memory_facts_superseded_by_id_fkey.*NOT DEFERRABLE",
      "reason": "Self-FK made DEFERRABLE INITIALLY IMMEDIATE in migration 20260710183055 so db-sync can upsert fact rows in arbitrary order (supersession pointers are not creation-ordered \u2014 the revive path points newer\u2192older). Prisma schema can't express DEFERRABLE.",
      "action": "remove"
    },
    {
      "pattern": "ALTER TABLE.*users.*ALTER CONSTRAINT.*users_default_vision_config_id_fkey.*NOT DEFERRABLE",
      "reason": "FK made DEFERRABLE INITIALLY IMMEDIATE in migration vision_config_kind so db-sync can copy a user row with non-NULL default_vision_config_id before the matching (vision-kind) llm_configs row arrives (mirrors the LLM/TTS circular-FK pattern). Prisma schema can't express DEFERRABLE.",
      "action": "remove"
    },
    {
      "pattern": "DROP INDEX.*idx_memory_facts_embedding",
      "reason": "IVFFlat index on memory_facts.embedding managed outside Prisma (Unsupported vector type)",
      "action": "remove"
    },
    {
      "pattern": "DROP INDEX.*idx_memories_null_embedding",
      "reason": "Partial index with WHERE clause cannot be represented in Prisma schema (backs NullVectorReembedder sweep)",
      "action": "remove"
    },
    {
      "pattern": "DROP INDEX.*personality_aliases_global_alias_unique",
      "reason": "Partial unique index on lower(alias) WHERE user_id IS NULL cannot be represented in Prisma schema",
      "action": "remove"
    },
    {
      "pattern": "DROP INDEX.*personality_aliases_user_alias_unique",
      "reason": "Partial unique index on (user_id, lower(alias)) WHERE user_id IS NOT NULL cannot be represented in Prisma schema",
      "action": "remove"
    }
  ],
  "documentation": {
    "driftIssuesDoc": "docs/reference/database/PRISMA_DRIFT_ISSUES.md",
    "vectorSkill": ".claude/skills/tzurot-db-vector/SKILL.md"
  }
}
